{
  "taskId": "harness-metrics-and-recovery-hardening",
  "branch": "fix/harness-metrics-and-recovery",
  "baseBranch": "health-recovery/task-20260917-devextreme-grid-poc-1b3e141191cf",
  "steps": [
    {
      "id": "attempt-and-continuation-metrics",
      "requirementIds": ["HARNESS-001", "HARNESS-002"],
      "files": ["scripts/Start-DevelopmentWorkflow.ps1", "scripts/Get-McpMigrationReport.ps1"],
      "change": "Give each role attempt one terminal result, record continuation separately, and aggregate only comparable production role attempts.",
      "validation": ["Verify one terminal role metric per attempt.", "Verify revisions, smoke tasks, and MCP tool-call metrics cannot enter role migration summaries."]
    },
    {
      "id": "effective-mcp-and-gates",
      "requirementIds": ["HARNESS-003", "HARNESS-004"],
      "files": ["scripts/Start-DevelopmentWorkflow.ps1", "scripts/Get-McpMigrationReport.ps1", "tests/Test-McpResilience.ps1"],
      "change": "Distinguish configured MCP mode from observed tool use and report every migration gate independently.",
      "validation": ["Verify zero MCP calls cannot be reported as effective MCP usage.", "Verify missing quality does not hide reliability or latency failures."]
    },
    {
      "id": "recovery-and-parser-hardening",
      "requirementIds": ["HARNESS-005", "HARNESS-006"],
      "files": ["scripts/Start-AgentHealthRecovery.ps1", "scripts/Start-HealthTargetedResume.ps1", "scripts/Invoke-GuardedCodex.ps1", "tests"],
      "change": "Keep ecosystem repair and task resume outcomes distinct, renew execution ownership before resume, and reject deterministic PowerShell parser failures without retry.",
      "validation": ["Exercise repaired-but-resume-failed and waiting outcomes.", "Run focused resilience tests, the complete ecosystem suite, and the health check."]
    }
  ],
  "heldScope": [
    "Model pricing, billing calculations, and external MCP server rollout remain outside this implementation.",
    "Historical metric files remain immutable; corrected aggregation applies when reports are regenerated."
  ],
  "requirementsRevision": "user-approved:2026-09-22",
  "knowledgeRevision": "harness-assessment:2026-09-22"
}
